{"$id":"https://example.invalid/jbspan/gate1/payload-registry-v1.schema.json","$schema":"https://json-schema.org/draft/2020-12/schema","additionalProperties":false,"properties":{"category_count":{"const":10},"development_count":{"const":50},"heldout_count":{"const":10},"payloads":{"items":{"additionalProperties":false,"properties":{"behavior":{"minLength":1,"type":"string"},"category":{"minLength":1,"type":"string"},"payload_character_length":{"minimum":1,"type":"integer"},"payload_id":{"pattern":"^JBB-[0-9]{3}$","type":"string"},"payload_sha256":{"pattern":"^[0-9a-f]{64}$","type":"string"},"payload_utf8_byte_length":{"minimum":1,"type":"integer"},"source_label":{"minLength":1,"type":"string"},"source_row_index":{"minimum":0,"type":"integer"},"split":{"enum":["gate1_development","gate2_heldout"]}},"required":["payload_id","source_row_index","behavior","category","source_label","payload_sha256","payload_character_length","payload_utf8_byte_length","split"],"type":"object"},"maxItems":60,"minItems":60,"type":"array","uniqueItems":true},"requested_source_revision":{"minLength":7,"type":"string"},"resolved_source_revision":{"pattern":"^[0-9a-f]{40}$","type":"string"},"schema_version":{"const":"gate1-payload-registry-v1"},"selection_method":{"const":"per_category_sha256_rank_v1"},"selection_seed":{"minLength":1,"type":"string"},"source_file_sha256":{"pattern":"^[0-9a-f]{64}$","type":"string"},"source_id":{"minLength":1,"type":"string"}},"required":["schema_version","source_id","requested_source_revision","resolved_source_revision","source_file_sha256","selection_method","selection_seed","category_count","development_count","heldout_count","payloads"],"title":"Gate 1 payload registry","type":"object"}
